{
  "dataset_id": "SA-REG-BASELINE-001",
  "dataset_version": "1.1",
  "record_kind": "label_authority_overlay",
  "base_dataset_version": "1.0",
  "status": "approved_synthetic",
  "adjudication_id": "SA-REG-COVERAGE-LABEL-ADJUDICATION-001",
  "applies_to_future_workflow_versions": ["1.6"],
  "retrospective_scoring_permitted": false,
  "overlays": [
    {
      "case_id": "CON-006",
      "coverage_state": "partial",
      "covered_element_ids": ["OEL-CON-ESTABLISH-001"],
      "uncovered_element_ids": ["OEL-CON-MAINTAIN-001"],
      "evidence_condition": "sufficient",
      "remediation_action_types": ["mapping_review"],
      "escalation_required": false,
      "escalation_roles": []
    },
    {
      "case_id": "CON-007",
      "coverage_state": "partial",
      "covered_element_ids": ["OEL-CON-ESTABLISH-001"],
      "uncovered_element_ids": ["OEL-CON-MAINTAIN-001"],
      "evidence_condition": "missing_operating_evidence",
      "remediation_action_types": ["mapping_review", "evidence_request"],
      "escalation_required": false,
      "escalation_roles": []
    },
    {
      "case_id": "CON-011",
      "coverage_state": "partial",
      "covered_element_ids": ["OEL-CON-ESTABLISH-001"],
      "uncovered_element_ids": ["OEL-CON-MAINTAIN-001"],
      "evidence_condition": "adverse_operating_evidence",
      "gap_severity": "high",
      "remediation_action_types": ["mapping_review", "operating_remediation"],
      "escalation_required": true,
      "escalation_roles": ["Conduct Risk Officer", "Head of Compliance"]
    },
    {
      "case_id": "CON-012",
      "coverage_state": "partial",
      "covered_element_ids": ["OEL-CON-MAINTAIN-001"],
      "uncovered_element_ids": ["OEL-CON-ESTABLISH-001"],
      "evidence_condition": "missing_operating_evidence",
      "remediation_action_types": ["mapping_review", "evidence_request"],
      "escalation_required": false,
      "escalation_roles": []
    }
  ]
}
